{
  "request_id": "req-20260324-001",
  "run_id": "run-20260324-postclose-001",
  "asof": "2026-03-24T15:00:00+08:00",
  "strategy_id": "ashare_quality_cashflow_regime_v1",
  "strategy_version": "0.1.0",
  "universe_version": "uv-20260324-001",
  "data_version": "dv-20260324-001",
  "feature_version": "fv-20260324-001",
  "policy_version": "pv-20260324-001",
  "security": {
    "ticker": "600519",
    "exchange": "SSE",
    "name": "贵州茅台",
    "board": "main",
    "security_type": "common_stock",
    "industry_l1": "食品饮料",
    "industry_l2": "白酒"
  },
  "universe_membership": {
    "included": true,
    "inclusion_reasons": [
      "INC_FULL_MARKET_SEED",
      "INC_BOARD_ALLOWED",
      "INC_LIQUIDITY_PASS"
    ],
    "exclusion_reasons": []
  },
  "result_state": "ok",
  "state_reason_codes": [],
  "label": "继续跟踪",
  "total_score": 72.5,
  "rank": 15,
  "percentile_rank": 0.05,
  "confidence": 0.92,
  "sub_scores": {
    "profitability_quality": 22.0,
    "cashflow_balance_sheet": 18.0,
    "growth_regime": 12.5,
    "valuation_sanity": 8.0,
    "market_confirmation": 17.0,
    "risk_penalty": -5.0
  },
  "penalties": [
    {
      "code": "RISK_MAJOR_REDUCTION",
      "score_impact": -3,
      "detail": "2026Q1 实控人减持计划公告，拟减持不超过 0.5% 股份。",
      "source_refs": [
        {
          "source_name": "SSE 公告",
          "source_type": "truth",
          "asof": "2026-03-20T18:00:00+08:00",
          "source_hash": "sha256:abc123def456"
        }
      ]
    },
    {
      "code": "RISK_GOODWILL_HIGH",
      "score_impact": -2,
      "detail": "商誉/净资产比 8.2%，略高于同行中位数。",
      "source_refs": [
        {
          "source_name": "2025 年报",
          "source_type": "truth",
          "asof": "2026-03-15T00:00:00+08:00",
          "source_hash": "sha256:789ghi012jkl"
        }
      ]
    }
  ],
  "drivers": [
    {
      "code": "DRV_ROE_EXCELLENCE",
      "title": "ROE 持续领先",
      "detail": "TTM ROE 32.1%，位于行业前 5%，连续 8 个季度保持同行 Top 10%。",
      "metric_id": "roe_ttm",
      "raw_value": 0.321,
      "normalized_value": 0.95,
      "direction": "higher_better",
      "source_refs": [
        {
          "source_name": "2025 年报",
          "source_type": "truth",
          "asof": "2026-03-15T00:00:00+08:00",
          "source_hash": "sha256:789ghi012jkl"
        }
      ]
    },
    {
      "code": "DRV_CASHFLOW_STRONG",
      "title": "经营现金流覆盖优异",
      "detail": "CFO/净利润 TTM 为 1.15，自由现金流率 28.3%。",
      "metric_id": "cfo_to_net_profit_ttm",
      "raw_value": 1.15,
      "normalized_value": 0.88,
      "direction": "higher_better",
      "source_refs": []
    }
  ],
  "risks": [
    {
      "code": "RISK_MAJOR_REDUCTION",
      "title": "实控人减持计划",
      "detail": "2026Q1 实控人拟减持不超过 0.5% 股份，短期可能形成股价压力。",
      "severity": "low",
      "source_refs": [
        {
          "source_name": "SSE 公告",
          "source_type": "truth",
          "asof": "2026-03-20T18:00:00+08:00",
          "source_hash": "sha256:abc123def456"
        }
      ]
    }
  ],
  "triggers": [
    {
      "code": "TRG_QUARTERLY_EARNINGS",
      "title": "下一季度业绩披露",
      "condition": "2026Q1 季报发布后重新评估 growth_regime 分组",
      "watch_metric": "revenue_yoy_acceleration",
      "source_refs": []
    }
  ],
  "invalidation": [
    {
      "code": "INV_ST_DESIGNATION",
      "title": "被 ST 标记",
      "condition": "如被实施 ST 或 *ST，当前结论立即失效",
      "watch_metric": null,
      "source_refs": []
    }
  ],
  "data_quality": {
    "critical_complete": true,
    "missing_features": [],
    "stale_sources": [],
    "degraded_reasons": []
  },
  "audit": {
    "render_tier": "R0",
    "disclaimer_id": "CN_R0_RESEARCH_ONLY_V1",
    "policy_passed": true,
    "banned_terms_checked": true,
    "source_hashes": [
      "sha256:abc123def456",
      "sha256:789ghi012jkl"
    ],
    "applied_reason_codes": [
      "INC_FULL_MARKET_SEED",
      "INC_BOARD_ALLOWED",
      "INC_SECURITY_TYPE_COMMON_STOCK",
      "INC_LISTED_DAYS_PASS",
      "INC_LIQUIDITY_PASS",
      "INC_FINANCIALS_READY",
      "INC_AUDIT_PASS",
      "INC_POSITIVE_EQUITY_PASS",
      "RISK_MAJOR_REDUCTION",
      "RISK_GOODWILL_HIGH"
    ]
  }
}
